readcode,medcode,readterm,clinicalevents,immunisationevents,referralevents,testevents,databaserelease,keep,clinevents,immevents,refevents,dbasebuild,_merge
S261.00,18336,open fracture of one or more phalanges of hand,886,0,22,0,February 2009,1,603,0,17,February 2009,matched (3)
S261000,36556,"open fracture of phalanx or phalanges, unspecified",232,0,2,0,February 2009,1,169,0,0,February 2009,matched (3)
S261300,61279,open fracture thumb proximal phalanx,79,0,0,0,February 2009,1,49,0,0,February 2009,matched (3)
S261400,94031,"open fracture thumb proximal phalanx, base",11,0,0,0,February 2009,1,5,0,0,February 2009,matched (3)
S261500,94416,"open fracture thumb proximal phalanx, shaft",5,0,0,0,February 2009,1,2,0,0,February 2009,matched (3)
S261600,99397,"open fracture thumb proximal phalanx, neck",1,0,0,0,May 2010,1,1,0,0,May 2010,matched (3)
S261700,101316,"open fracture thumb proximal phalanx, head",2,0,0,0,January 2011,1,2,0,0,January 2011,matched (3)
S261800,37986,open fracture thumb distal phalanx,270,0,0,0,February 2009,1,154,0,0,February 2009,matched (3)
S261900,65731,"open fracture thumb distal phalanx, base",17,0,0,0,February 2009,1,13,0,0,February 2009,matched (3)
S261A00,65715,"open fracture thumb distal phalanx, shaft",11,0,0,0,February 2009,1,9,0,0,February 2009,matched (3)
S261B00,53593,"open fracture thumb distal phalanx, tuft",32,0,0,0,February 2009,1,17,0,0,February 2009,matched (3)
S261C00,103416,"open fracture thumb distal phalanx, mallet",7,0,0,0,December 2011,1,3,0,0,December 2011,matched (3)
S261D00,33684,open fracture finger proximal phalanx,356,0,1,0,February 2009,1,176,0,1,February 2009,matched (3)
S261E00,44700,"open fracture finger proximal phalanx, base",42,0,0,0,February 2009,1,32,0,0,February 2009,matched (3)
S261F00,62334,"open fracture finger proximal phalanx, shaft",16,0,0,0,February 2009,1,6,0,0,February 2009,matched (3)
S261G00,64113,"open fracture finger proximal phalanx, neck",8,0,1,0,February 2009,1,4,0,0,February 2009,matched (3)
S261H00,61529,"open fracture finger proximal phalanx, head",14,0,0,0,February 2009,1,9,0,0,February 2009,matched (3)
S261J00,69729,"open fracture finger proximal phalanx, multiple",5,0,0,0,February 2009,1,4,0,0,February 2009,matched (3)
S261K00,40304,open fracture finger middle phalanx,280,0,2,0,February 2009,1,170,0,1,February 2009,matched (3)
S261L00,67718,"open fracture finger middle phalanx, base",22,0,1,0,February 2009,1,13,0,1,February 2009,matched (3)
S261M00,33866,"open fracture finger middle phalanx, shaft",19,0,0,0,February 2009,1,12,0,0,February 2009,matched (3)
S261N00,69363,"open fracture finger middle phalanx, neck",4,0,0,0,February 2009,1,3,0,0,February 2009,matched (3)
S261P00,99459,"open fracture finger middle phalanx, head",12,0,0,0,May 2010,1,7,0,0,May 2010,matched (3)
S261Q00,112876,"open fracture finger middle phalanx, multiple",6,0,0,0,September 2018,1,,,,,master only (1)
S261R00,28197,open fracture finger distal phalanx,1120,0,7,0,February 2009,1,673,0,7,February 2009,matched (3)
S261S00,48837,"open fracture finger distal phalanx, base",36,0,3,0,February 2009,1,21,0,1,February 2009,matched (3)
S261T00,52333,"open fracture finger distal phalanx, shaft",33,0,0,0,February 2009,1,18,0,0,February 2009,matched (3)
S261U00,51700,"open fracture finger distal phalanx, tuft",125,0,0,0,February 2009,1,78,0,0,February 2009,matched (3)
S261V00,102046,"open fracture finger distal phalanx, mallet",15,0,0,0,April 2011,1,9,0,0,April 2011,matched (3)
S261W00,54123,"open fracture finger distal phalanx, multiple",10,0,0,0,February 2009,1,6,0,0,February 2009,matched (3)
S261x00,67011,"open fracture of phalanx or phalanges, multiple sites",16,0,1,0,February 2009,1,9,0,1,February 2009,matched (3)
S261z00,50781,open fracture of one or more phalanges of hand nos,117,0,2,0,February 2009,1,80,0,2,February 2009,matched (3)
S262.00,7500,fracture of thumb,30996,0,263,0,February 2009,1,22139,0,219,February 2009,matched (3)
S263.00,6299,fracture of other finger,38095,0,402,0,February 2009,1,28171,0,365,February 2009,matched (3)
S264.00,8199,multiple fractures of fingers,5676,0,177,0,February 2009,1,4396,0,164,February 2009,matched (3)
S26z.00,4582,fracture of one or more phalanges of hand nos,31967,0,4832,9,February 2009,1,29871,0,4797,February 2009,matched (3)
S27..00,33908,multiple fractures of hand bones,387,0,17,0,February 2009,1,284,0,16,February 2009,matched (3)
S270.00,44431,closed multiple fractures of hand bones,152,0,4,0,February 2009,1,100,0,4,February 2009,matched (3)
S271.00,33990,open multiple fractures of hand bones,16,0,0,0,February 2009,1,10,0,0,February 2009,matched (3)
S27z.00,53923,multiple fractures of hand bones nos,89,0,1,0,February 2009,1,59,0,1,February 2009,matched (3)
S28..00,49267,ill-defined fractures of upper limb,190,0,3,0,February 2009,1,95,0,3,February 2009,matched (3)
S28..11,1179,ill-defined fracture of arm,6058,0,1451,5,February 2009,1,5709,0,1349,February 2009,matched (3)
S280.00,47478,closed ill-defined fractures of upper limb,96,0,1,0,February 2009,1,71,0,1,February 2009,matched (3)
S281.00,66853,open ill-defined fractures of upper limb,1,0,1,0,February 2009,1,1,0,1,February 2009,matched (3)
S28z.00,2660,ill-defined fractures of upper limb nos,4338,0,801,1,February 2009,1,4216,0,784,February 2009,matched (3)
S29..11,31708,multiple fractures of arm,88,0,3,0,February 2009,1,68,0,3,February 2009,matched (3)
S29..12,17107,multiple rib fractures,2716,0,14,0,February 2009,1,1614,0,12,February 2009,matched (3)
S29..13,68899,multiple fractures of sternum,19,0,0,0,February 2009,1,5,0,0,February 2009,matched (3)
S292.00,16944,"multiple fractures of clavicle, scapula and humerus",1254,0,41,0,February 2009,1,1012,0,36,February 2009,matched (3)
S292000,40976,"closed multiple fractures of clavicle, scapula and humerus",93,0,1,0,February 2009,1,77,0,1,February 2009,matched (3)
S292100,66237,"open multiple fractures of clavicle, scapula and humerus",2,0,0,0,February 2009,1,2,0,0,February 2009,matched (3)
S293.00,8915,multiple fractures of forearm,1026,0,49,0,February 2009,1,807,0,45,February 2009,matched (3)
S294.00,27605,fractures involving multiple regions of both upper limbs,43,0,4,0,February 2009,1,34,0,3,February 2009,matched (3)
S294000,95633,cl fractures involving multiple regions of both upper limbs,6,0,0,0,February 2009,1,1,0,0,February 2009,matched (3)
S2A..00,33882,"fracture of upper limb, level unspecified",330,0,5,0,February 2009,1,247,0,5,February 2009,matched (3)
S2B..00,12516,fracture of bone of hand,13287,0,63,0,February 2009,1,8457,0,60,February 2009,matched (3)
S2z..00,30076,fracture of upper limb nos,3639,0,84,2,February 2009,1,2388,0,74,February 2009,matched (3)
S3...00,8891,fracture of lower limb,46553,0,665,0,February 2009,1,30783,0,579,February 2009,matched (3)
S3...11,2603,leg fracture,13818,0,996,1,February 2009,1,10955,0,937,February 2009,matched (3)
S30..00,2225,fracture of neck of femur,150877,0,6969,8,February 2009,1,113998,0,6718,February 2009,matched (3)
S30..11,1994,hip fracture,28044,0,1981,3,February 2009,1,20738,0,1811,February 2009,matched (3)
S300.00,38489,"closed fracture proximal femur, transcervical",180,0,4,1,February 2009,1,124,0,4,February 2009,matched (3)
S300100,69919,"closed fracture proximal femur, transepiphyseal",8,0,0,0,February 2009,1,3,0,0,February 2009,matched (3)
S300200,65690,"closed fracture proximal femur, midcervical section",7,0,0,0,February 2009,1,5,0,0,February 2009,matched (3)
S300300,52194,"closed fracture proximal femur, basicervical",70,0,0,0,February 2009,1,47,0,0,February 2009,matched (3)
S300311,51861,"closed fracture, base of neck of femur",167,0,1,0,February 2009,1,87,0,1,February 2009,matched (3)
S300400,36391,closed fracture head of femur,302,0,2,0,February 2009,1,143,0,2,February 2009,matched (3)
S300600,34351,"closed fracture proximal femur, subcapital, garden grade i",84,0,2,0,February 2009,1,63,0,2,February 2009,matched (3)
S300700,33957,"closed fracture proximal femur, subcapital, garden grade ii",28,0,1,0,February 2009,1,24,0,1,February 2009,matched (3)
S300800,36599,"closed fracture proximal femur, subcapital, garden grade iii",30,0,1,0,February 2009,1,27,0,1,February 2009,matched (3)
S300900,34078,"closed fracture proximal femur, subcapital, garden grade iv",54,0,0,0,February 2009,1,42,0,0,February 2009,matched (3)
S300A00,45779,"closed fracture of femur, upper epiphysis",82,0,0,0,February 2009,1,48,0,0,February 2009,matched (3)
S300y00,49209,"closed fracture proximal femur, other transcervical",47,0,1,0,February 2009,1,28,0,1,February 2009,matched (3)
S300y11,68229,"closed fracture of femur, subcapital",67,0,0,0,February 2009,1,40,0,0,February 2009,matched (3)
S300z00,62966,"closed fracture proximal femur, transcervical, nos",36,0,0,0,February 2009,1,20,0,0,February 2009,matched (3)
S301.00,73981,"open fracture proximal femur, transcervical",4,0,0,0,February 2009,1,1,0,0,February 2009,matched (3)
S301100,72138,"open fracture proximal femur, transepiphyseal",2,0,0,0,February 2009,1,2,0,0,February 2009,matched (3)
S301200,112836,"open fracture proximal femur, midcervical section",2,0,0,0,August 2018,1,,,,,master only (1)
S301300,113426,"open fracture proximal femur, basicervical",2,0,0,0,March 2019,1,,,,,master only (1)
S301311,100771,open fracture base of neck of femur,6,0,0,0,November 2010,1,1,0,0,November 2010,matched (3)
S301400,73210,"open fracture head, femur",18,0,0,0,February 2009,1,3,0,0,February 2009,matched (3)
S301500,38878,"open fracture proximal femur,subcapital, garden grade unspec",26,0,1,0,February 2009,1,20,0,1,February 2009,matched (3)
S301600,60885,"open fracture proximal femur,subcapital, garden grade i",5,0,0,0,February 2009,1,3,0,0,February 2009,matched (3)
S301700,67394,"open fracture proximal femur,subcapital, garden grade ii",3,0,0,0,February 2009,1,3,0,0,February 2009,matched (3)
S301800,23803,"open fracture proximal femur,subcapital, garden grade iii",1,0,0,0,February 2009,1,1,0,0,February 2009,matched (3)
S301900,51999,"open fracture proximal femur,subcapital, garden grade iv",3,0,0,0,February 2009,1,3,0,0,February 2009,matched (3)
S301A00,96518,"open fracture of femur, upper epiphysis",4,0,0,0,April 2009,1,2,0,0,April 2009,matched (3)
S301y00,68668,"open fracture proximal femur, other transcervical",6,0,0,0,February 2009,1,2,0,0,February 2009,matched (3)
S301y11,73234,"open fracture of femur, subcapital",2,0,0,0,February 2009,1,1,0,0,February 2009,matched (3)
S301z00,112712,"open fracture proximal femur, transcervical, nos",3,0,0,0,May 2018,1,,,,,master only (1)
S302.00,5301,"closed fracture of proximal femur, pertrochanteric",1429,0,109,0,February 2009,1,1190,0,106,February 2009,matched (3)
S302011,19387,"closed fracture of femur, greater trochanter",679,0,8,0,February 2009,1,426,0,7,February 2009,matched (3)
S302012,48337,"closed fracture of femur, lesser trochanter",59,0,0,0,February 2009,1,39,0,0,February 2009,matched (3)
S302100,45141,"closed fracture proximal femur, intertrochanteric, two part",82,0,0,0,February 2009,1,48,0,0,February 2009,matched (3)
S302200,29145,"closed fracture proximal femur, subtrochanteric",132,0,1,0,February 2009,1,77,0,1,February 2009,matched (3)
S302400,8648,"closed fracture of femur, intertrochanteric",2369,0,29,0,February 2009,1,1592,0,21,February 2009,matched (3)
S303.00,61733,"open fracture of proximal femur, pertrochanteric",37,0,1,0,February 2009,1,21,0,0,February 2009,matched (3)
S303011,96644,"open fracture of femur, greater trochanter",12,0,0,0,April 2009,1,3,0,0,April 2009,matched (3)
S303012,112991,"open fracture of femur, lesser trochanter",2,0,0,0,October 2018,1,,,,,master only (1)
S303100,101567,"open fracture proximal femur, intertrochanteric, two part",4,0,0,0,January 2011,1,2,0,0,January 2011,matched (3)
S303200,71282,"open fracture proximal femur, subtrochanteric",7,0,0,0,February 2009,1,4,0,0,February 2009,matched (3)
S303300,97971,"open fracture proximal femur, intertrochanteric, comminuted",2,0,0,0,November 2009,1,1,0,0,November 2009,matched (3)
S303400,39396,"open fracture of femur, intertrochanteric",84,0,0,0,February 2009,1,55,0,0,February 2009,matched (3)
S303z00,70479,"open fracture of proximal femur, pertrochanteric, nos",3,0,0,0,February 2009,1,3,0,0,February 2009,matched (3)
S304.00,28965,pertrochanteric fracture,191,0,3,0,February 2009,1,136,0,3,February 2009,matched (3)
S305.00,8243,subtrochanteric fracture,1322,0,6,0,February 2009,1,969,0,4,February 2009,matched (3)
S30w.00,24276,closed fracture of unspecified proximal femur,431,0,2,0,February 2009,1,246,0,1,February 2009,matched (3)
S30x.00,58642,open fracture of unspecified proximal femur,25,0,0,0,February 2009,1,12,0,0,February 2009,matched (3)
S30y.00,18273,closed fracture of neck of femur nos,3972,0,59,0,February 2009,1,2231,0,48,February 2009,matched (3)
S30y.11,10570,hip fracture nos,2505,0,70,0,February 2009,1,2018,0,63,February 2009,matched (3)
S30z.00,38054,open fracture of neck of femur nos,137,0,0,0,February 2009,1,60,0,0,February 2009,matched (3)
S31..00,8040,other fracture of femur,15432,0,137,0,February 2009,1,11484,0,126,February 2009,matched (3)
S310.00,6868,"closed fracture of femur, shaft or unspecified part",4549,0,56,0,February 2009,1,3628,0,49,February 2009,matched (3)
S310000,37662,"closed fracture of femur, unspecified part",678,0,23,0,February 2009,1,451,0,17,February 2009,matched (3)
S310011,12791,thigh fracture nos,511,0,14,0,February 2009,1,397,0,12,February 2009,matched (3)
S310012,20893,upper leg fracture nos,76,0,2,0,February 2009,1,52,0,2,February 2009,matched (3)
S310100,24674,closed fracture shaft of femur,2298,0,9,0,February 2009,1,1454,0,9,February 2009,matched (3)
S310z00,52318,"closed fracture of shaft or unspecified part, nos",72,0,2,1,February 2009,1,52,0,2,February 2009,matched (3)
S311.00,42972,"open fracture of femur, shaft or unspecified part",105,0,0,0,February 2009,1,74,0,0,February 2009,matched (3)
S311000,34106,"open fracture of femur, unspecified part",63,0,0,0,February 2009,1,39,0,0,February 2009,matched (3)
S311100,10095,open fracture shaft of femur,182,0,0,0,February 2009,1,117,0,0,February 2009,matched (3)
S311z00,94360,"open fracture of femur, shaft or unspecified part, nos",13,0,0,0,February 2009,1,8,0,0,February 2009,matched (3)
S312.00,28954,closed fracture distal femur,1186,0,15,0,February 2009,1,705,0,13,February 2009,matched (3)
S312.11,22329,"closed fracture of femur, distal end",1102,0,12,0,February 2009,1,813,0,12,February 2009,matched (3)
S312000,53279,"closed fracture of distal femur, unspecified",202,0,2,0,February 2009,1,138,0,2,February 2009,matched (3)
S312100,6320,"closed fracture of femoral condyle, unspecified",1020,0,16,0,February 2009,1,654,0,15,February 2009,matched (3)
S312200,21922,"closed fracture of femur, lower epiphysis",425,0,2,0,February 2009,1,332,0,2,February 2009,matched (3)
S312300,5332,"closed fracture distal femur, supracondylar",1906,0,13,0,February 2009,1,1304,0,12,February 2009,matched (3)
S312400,45562,"closed fracture distal femur, medial condyle",228,0,7,0,February 2009,1,158,0,3,February 2009,matched (3)
S312500,38355,"closed fracture distal femur, lateral condyle",244,0,1,0,February 2009,1,167,0,1,February 2009,matched (3)
S312600,54242,"closed fracture distal femur, bicondylar (t-y fracture)",3,0,0,0,February 2009,1,3,0,0,February 2009,matched (3)
S312x00,55327,"closed fracture distal femur, comminuted/intra-articular",31,0,0,0,February 2009,1,18,0,0,February 2009,matched (3)
S312z00,61802,closed fracture of distal femur not otherwise specified,76,0,2,0,February 2009,1,46,0,2,February 2009,matched (3)
S313.00,51170,open fracture distal femur,101,0,1,0,February 2009,1,67,0,1,February 2009,matched (3)
S313.11,32866,"open fracture of femur, distal end",96,0,0,0,February 2009,1,73,0,0,February 2009,matched (3)
S313000,45529,"open fracture distal femur, unspecified",23,0,1,0,February 2009,1,14,0,1,February 2009,matched (3)
S313100,49595,"open fracture of femoral condyle, unspecified",82,0,1,0,February 2009,1,56,0,1,February 2009,matched (3)
S313200,48142,"open fracture of femur, lower epiphysis",25,0,0,0,February 2009,1,21,0,0,February 2009,matched (3)
S313300,42805,"open fracture distal femur, supracondylar",120,0,0,0,February 2009,1,87,0,0,February 2009,matched (3)
S313400,67294,"open fracture distal femur, medial condyle",16,0,0,0,February 2009,1,11,0,0,February 2009,matched (3)
S313500,34738,"open fracture distal femur, lateral condyle",14,0,1,0,February 2009,1,10,0,1,February 2009,matched (3)
S313600,113450,"open fracture distal femur, bicondylar (t-y fracture)",1,0,0,0,March 2019,1,,,,,master only (1)
S313x00,73208,"open fracture distal femur, comminuted/intra-articular",8,0,0,0,February 2009,1,3,0,0,February 2009,matched (3)
S313z00,88737,open fracture of distal femur not otherwise specified,5,0,0,0,February 2009,1,3,0,0,February 2009,matched (3)
S314.00,8646,fracture of shaft of femur,6282,0,34,0,February 2009,1,4108,0,29,February 2009,matched (3)
S315.00,8589,fracture of lower end of femur,998,0,18,1,February 2009,1,732,0,17,February 2009,matched (3)
S31z.00,520,"fracture of femur, nos",45738,0,3793,12,February 2009,1,38802,0,3624,February 2009,matched (3)
S32..00,235,fracture of patella,30596,0,1193,2,February 2009,1,23713,0,1145,February 2009,matched (3)
S320.00,33393,closed fracture of the patella,1623,0,11,0,February 2009,1,911,0,8,February 2009,matched (3)
S320000,49526,"closed fracture patella, transverse",130,0,0,0,February 2009,1,95,0,0,February 2009,matched (3)
S320100,50549,"closed fracture patella, proximal pole",33,0,0,0,February 2009,1,23,0,0,February 2009,matched (3)
S320200,44329,"closed fracture patella, distal pole",153,0,2,0,February 2009,1,104,0,1,February 2009,matched (3)
S320300,54660,"closed fracture patella, vertical",38,0,2,0,February 2009,1,24,0,1,February 2009,matched (3)
S320400,41287,"closed fracture patella, comminuted (stellate)",97,0,2,0,February 2009,1,76,0,1,February 2009,matched (3)
S321.00,28273,open fracture of the patella,177,0,2,0,February 2009,1,107,0,2,February 2009,matched (3)
S321000,50227,"open fracture patella, transverse",9,0,0,0,February 2009,1,6,0,0,February 2009,matched (3)
S321100,100159,"open fracture patella, proximal pole",3,0,0,0,July 2010,1,2,0,0,July 2010,matched (3)
S321200,33475,"open fracture patella, distal pole",3,0,0,0,February 2009,1,2,0,0,February 2009,matched (3)
S321300,114818,"open fracture patella, vertical",1,0,0,0,April 2020,1,,,,,master only (1)
S321400,50254,"open fracture patella, comminuted (stellate)",31,0,0,0,February 2009,1,21,0,0,February 2009,matched (3)
S32z.00,35011,"fracture of patella, nos",1224,0,20,1,February 2009,1,759,0,17,February 2009,matched (3)
S33..00,2630,fracture of tibia and fibula,63692,0,1140,7,February 2009,1,45341,0,1046,February 2009,matched (3)
S330.00,44830,"closed fracture of tibia and fibula, proximal",365,0,1,0,February 2009,1,254,0,1,February 2009,matched (3)
S330000,28550,closed fracture of the proximal tibia,1590,0,11,0,February 2009,1,972,0,10,February 2009,matched (3)
S330011,53951,closed fracture of tibial condyles,104,0,1,0,February 2009,1,50,0,1,February 2009,matched (3)
S330012,22761,closed fracture of tibial tuberosity,607,0,3,0,February 2009,1,376,0,3,February 2009,matched (3)
S330100,33656,closed fracture proximal fibula,747,0,2,1,February 2009,1,462,0,2,February 2009,matched (3)
S330200,54280,"closed fracture of tibia and fibula, proximal",104,0,0,0,February 2009,1,72,0,0,February 2009,matched (3)
S330500,40164,"closed fracture proximal tibia, bicondylar",46,0,2,0,February 2009,1,34,0,2,February 2009,matched (3)
S330600,33768,"closed fracture spine, tibia",276,0,1,0,February 2009,1,153,0,1,February 2009,matched (3)
S330700,38733,"closed fracture tubercle, tibia",171,0,1,0,February 2009,1,121,0,1,February 2009,matched (3)
S330800,52499,"closed fracture fibula, head",381,0,1,0,February 2009,1,235,0,1,February 2009,matched (3)
S330900,52322,"closed fracture fibula, neck",334,0,2,0,February 2009,1,207,0,0,February 2009,matched (3)
S330z00,42978,"closed fracture of tibia and fibula, proximal nos",46,0,2,0,February 2009,1,34,0,2,February 2009,matched (3)
S331.00,40069,"open fracture of tibia and fibula, proximal",107,0,0,0,February 2009,1,75,0,0,February 2009,matched (3)
S331000,33706,open fracture of the proximal tibia,126,0,1,0,February 2009,1,81,0,1,February 2009,matched (3)
S331011,93029,open fracture of tibial condyles,13,0,0,0,February 2009,1,7,0,0,February 2009,matched (3)
S331012,49801,open fracture of tibial tuberosity,42,0,1,0,February 2009,1,28,0,1,February 2009,matched (3)
S331100,33457,open fracture proximal fibula,24,0,0,0,February 2009,1,13,0,0,February 2009,matched (3)
S331200,54145,"open fracture of tibia and fibula, proximal",18,0,0,0,February 2009,1,13,0,0,February 2009,matched (3)
S331500,112873,"open fracture proximal tibia, bicondylar",3,0,0,0,September 2018,1,,,,,master only (1)
S331600,63633,"open fracture spine, tibia",11,0,0,0,February 2009,1,6,0,0,February 2009,matched (3)
S331700,49798,"open fracture tubercle, tibia",11,0,0,0,February 2009,1,4,0,0,February 2009,matched (3)
S331800,99027,"open fracture fibula, head",5,0,0,0,April 2010,1,2,0,0,April 2010,matched (3)
S331900,99161,"open fracture fibula, neck",6,0,0,0,April 2010,1,3,0,0,April 2010,matched (3)
S331z00,57439,"open fracture of tibia and fibula, proximal nos",16,0,0,0,February 2009,1,8,0,0,February 2009,matched (3)
S332.00,29121,"closed fracture of tibia/fibula, shaft",989,0,11,0,February 2009,1,725,0,10,February 2009,matched (3)
S332000,34021,closed fracture shaft of tibia,2434,0,1,0,February 2009,1,1561,0,1,February 2009,matched (3)
S332100,28426,closed fracture shaft of fibula,1038,0,2,0,February 2009,1,644,0,2,February 2009,matched (3)
S332200,33520,"closed fracture of tibia and fibula, shaft",643,0,3,0,February 2009,1,407,0,2,February 2009,matched (3)
S332z00,55464,"closed fracture of tibia and fibula, shaft, nos",116,0,3,0,February 2009,1,81,0,1,February 2009,matched (3)
S333.00,28068,"open fracture of tibia/fibula, shaft",343,0,3,0,February 2009,1,244,0,3,February 2009,matched (3)
S333000,28118,open fracture shaft of tibia,263,0,2,0,February 2009,1,200,0,2,February 2009,matched (3)
S333100,51938,open fracture shaft of fibula,33,0,0,0,February 2009,1,24,0,0,February 2009,matched (3)
S333200,20678,"open fracture of tibia and fibula, shaft",212,0,3,0,February 2009,1,149,0,3,February 2009,matched (3)
S333z00,28198,"open fracture of tibia and fibula, shaft, nos",32,0,0,0,February 2009,1,26,0,0,February 2009,matched (3)
S334.00,27719,closed fracture distal tibia,7287,0,31,0,February 2009,1,4838,0,28,February 2009,matched (3)
S334000,34151,"closed fracture distal tibia, extra-articular",184,0,4,0,February 2009,1,121,0,3,February 2009,matched (3)
S334100,8465,"closed fracture distal tibia, intra-articular",128,0,2,0,February 2009,1,80,0,2,February 2009,matched (3)
S335.00,27992,open fracture distal tibia,586,0,3,0,February 2009,1,407,0,2,February 2009,matched (3)
S335000,27721,"open fracture distal tibia, extra-articular",25,0,0,0,February 2009,1,20,0,0,February 2009,matched (3)
S335100,65228,"open fracture distal tibia, intra-articular",20,0,0,0,February 2009,1,15,0,0,February 2009,matched (3)
S336.00,6917,fracture of upper end of tibia,2256,0,23,0,February 2009,1,1585,0,22,February 2009,matched (3)
S337.00,7723,fracture of shaft of tibia,11177,0,82,0,February 2009,1,8243,0,73,February 2009,matched (3)
S338.00,10007,fracture of lower end of tibia,3964,0,13,0,February 2009,1,2762,0,11,February 2009,matched (3)
S339.00,806,fracture of fibula alone,35397,0,1586,4,February 2009,1,25586,0,1504,February 2009,matched (3)
S339000,6839,closed fracture of distal fibula,12311,0,159,0,February 2009,1,7958,0,146,February 2009,matched (3)
S339100,12369,open fracture of distal fibula,158,0,3,0,February 2009,1,101,0,3,February 2009,matched (3)
S33A.00,78444,fracture of tibia,27432,0,104,0,February 2009,1,18468,0,74,February 2009,matched (3)
S33B.00,100640,open fracture of distal tibia and fibula,184,0,1,0,September 2010,1,93,0,0,September 2010,matched (3)
S33C.00,100202,closed fracture of distal tibia and fibula,875,0,1,0,July 2010,1,528,0,1,July 2010,matched (3)
S33x.00,29109,"closed fracture of tibia and fibula, unspecified part, nos",900,0,31,0,February 2009,1,634,0,23,February 2009,matched (3)
S33x.11,35253,lower leg fracture nos,1357,0,24,0,February 2009,1,895,0,24,February 2009,matched (3)
S33x000,971,"closed fracture of tibia, unspecified part, nos",43516,0,3389,6,February 2009,1,38466,0,3249,February 2009,matched (3)
S33x100,4304,"closed fracture of fibula, unspecified part, nos",13513,0,1152,4,February 2009,1,11903,0,1118,February 2009,matched (3)
S33x200,4572,"closed fracture of tibia and fibula, unspecified part",6539,0,500,3,February 2009,1,6182,0,498,February 2009,matched (3)
S33xz00,41971,"closed fracture of tibia and fibula, unspecified part, nos",188,0,0,0,February 2009,1,128,0,0,February 2009,matched (3)
S33y.00,28233,"open fracture of tibia and fibula, unspecified part, nos",380,0,4,0,February 2009,1,270,0,4,February 2009,matched (3)
S33y000,29164,"open fracture of tibia, unspecified part, nos",301,0,2,0,February 2009,1,201,0,2,February 2009,matched (3)
S33y100,28352,"open fracture of fibula, unspecified part, nos",46,0,2,0,February 2009,1,32,0,1,February 2009,matched (3)
S33y200,29084,"open fracture of tibia and fibula, unspecified part",144,0,2,0,February 2009,1,93,0,2,February 2009,matched (3)
S33yz00,62787,"open fracture of tibia and fibula, unspecified part, nos",73,0,0,0,February 2009,1,50,0,0,February 2009,matched (3)
S33z.00,25485,"fracture of tibia and fibula, nos",5540,0,39,0,February 2009,1,3322,0,36,February 2009,matched (3)
S34..00,325,fracture of ankle,189000,0,9737,32,February 2009,1,144226,0,9184,February 2009,matched (3)
S340.00,6286,"closed fracture ankle, medial malleolus",12269,0,110,0,February 2009,1,8615,0,97,February 2009,matched (3)
